{
  "schema_version": 1,
  "id": "obs-mascot-v1",
  "layout": {
    "columns": 4,
    "cell_width": 128,
    "cell_height": 128
  },
  "states": [
    {
      "id": "idle",
      "purpose": "An unobtrusive resting loop suitable for a transparent stream overlay.",
      "frames": 4,
      "durations": [
        180,
        160,
        160,
        240
      ],
      "alignment": {
        "coordinate_policy": "slot",
        "scale_policy": "row",
        "padding": 5,
        "anchor": [
          0.5,
          0.9
        ],
        "pivot": [
          0.5,
          0.9
        ]
      },
      "motion": "quiet",
      "generation": {
        "skill": "imagegen",
        "requires_identity_reference": true,
        "instructions": "An unobtrusive resting loop suitable for a transparent stream overlay."
      },
      "allowed_derivations": [],
      "validation": {
        "min_motion": 0.0001,
        "max_size_ratio": 1.8,
        "max_baseline_shift": 0.2,
        "loop_warning_ratio": 3.0
      }
    },
    {
      "id": "welcome",
      "purpose": "Greet viewers with a hand or paw wave, then return to rest.",
      "frames": 4,
      "durations": [
        180,
        160,
        160,
        240
      ],
      "alignment": {
        "coordinate_policy": "slot",
        "scale_policy": "row",
        "padding": 5,
        "anchor": [
          0.5,
          0.9
        ],
        "pivot": [
          0.5,
          0.9
        ]
      },
      "motion": "gesture",
      "generation": {
        "skill": "imagegen",
        "requires_identity_reference": true,
        "instructions": "Greet viewers with a hand or paw wave, then return to rest."
      },
      "allowed_derivations": [],
      "validation": {
        "min_motion": 0.0001,
        "max_size_ratio": 1.8,
        "max_baseline_shift": 0.2,
        "loop_warning_ratio": 3.0
      }
    },
    {
      "id": "celebrate",
      "purpose": "Celebrate an event with a small upward lift, happy expression, then settle.",
      "frames": 4,
      "durations": [
        180,
        160,
        160,
        240
      ],
      "alignment": {
        "coordinate_policy": "slot",
        "scale_policy": "row",
        "padding": 5,
        "anchor": [
          0.5,
          0.9
        ],
        "pivot": [
          0.5,
          0.9
        ]
      },
      "motion": "vertical",
      "generation": {
        "skill": "imagegen",
        "requires_identity_reference": true,
        "instructions": "Celebrate an event with a small upward lift, happy expression, then settle."
      },
      "allowed_derivations": [],
      "validation": {
        "min_motion": 0.0001,
        "max_size_ratio": 1.8,
        "max_baseline_shift": 0.65,
        "loop_warning_ratio": 3.0
      }
    }
  ],
  "generation": {
    "skill": "imagegen",
    "requires_identity_reference": true,
    "instructions": "Create a consistent full-body recurring character for obs mascot. The output is a local asset family; do not imply integration with an external service or device.",
    "requirements": [
      "Preserve the approved identity, proportions, palette, material and props across all states.",
      "Keep the background transparent and all character motion within its slot. Do not draw text, guides, scenery or unapproved props."
    ]
  },
  "validation": {
    "require_provenance": true,
    "allow_detached_details": false
  },
  "export": {
    "formats": [
      "frames",
      "atlas",
      "gif",
      "webp",
      "browser"
    ],
    "static_state": "idle",
    "static_frame": 0
  },
  "events": {
    "quiet": "idle",
    "greeting": "welcome",
    "milestone": "celebrate"
  }
}
