{
  "schema_version": 1,
  "id": "storyboard-v1",
  "layout": {
    "columns": 4,
    "cell_width": 128,
    "cell_height": 128
  },
  "states": [
    {
      "id": "establish",
      "purpose": "Establish the recurring character in a neutral pose, with one slow attentive glance.",
      "frames": 4,
      "durations": [
        180,
        160,
        160,
        240
      ],
      "alignment": {
        "coordinate_policy": "slot",
        "scale_policy": "row",
        "padding": 5,
        "anchor": [
          0.5,
          0.9
        ],
        "pivot": [
          0.5,
          0.9
        ]
      },
      "motion": "quiet",
      "generation": {
        "skill": "imagegen",
        "requires_identity_reference": true,
        "instructions": "Establish the recurring character in a neutral pose, with one slow attentive glance."
      },
      "allowed_derivations": [],
      "validation": {
        "min_motion": 0.0001,
        "max_size_ratio": 1.8,
        "max_baseline_shift": 0.2,
        "loop_warning_ratio": 3.0
      }
    },
    {
      "id": "react",
      "purpose": "React to an offscreen event with surprise, a short pause, then regained attention.",
      "frames": 4,
      "durations": [
        180,
        160,
        160,
        240
      ],
      "alignment": {
        "coordinate_policy": "slot",
        "scale_policy": "row",
        "padding": 5,
        "anchor": [
          0.5,
          0.9
        ],
        "pivot": [
          0.5,
          0.9
        ]
      },
      "motion": "gesture",
      "generation": {
        "skill": "imagegen",
        "requires_identity_reference": true,
        "instructions": "React to an offscreen event with surprise, a short pause, then regained attention."
      },
      "allowed_derivations": [],
      "validation": {
        "min_motion": 0.0001,
        "max_size_ratio": 1.8,
        "max_baseline_shift": 0.2,
        "loop_warning_ratio": 3.0
      }
    },
    {
      "id": "resolve",
      "purpose": "Resolve the beat with a relieved expression and small confident nod.",
      "frames": 4,
      "durations": [
        180,
        160,
        160,
        240
      ],
      "alignment": {
        "coordinate_policy": "slot",
        "scale_policy": "row",
        "padding": 5,
        "anchor": [
          0.5,
          0.9
        ],
        "pivot": [
          0.5,
          0.9
        ]
      },
      "motion": "gesture",
      "generation": {
        "skill": "imagegen",
        "requires_identity_reference": true,
        "instructions": "Resolve the beat with a relieved expression and small confident nod."
      },
      "allowed_derivations": [],
      "validation": {
        "min_motion": 0.0001,
        "max_size_ratio": 1.8,
        "max_baseline_shift": 0.2,
        "loop_warning_ratio": 3.0
      }
    }
  ],
  "generation": {
    "skill": "imagegen",
    "requires_identity_reference": true,
    "instructions": "Create a consistent full-body recurring character for storyboard. The output is a local asset family; do not imply integration with an external service or device.",
    "requirements": [
      "Preserve the approved identity, proportions, palette, material and props across all states.",
      "Keep the background transparent and all character motion within its slot. Do not draw text, guides, scenery or unapproved props."
    ]
  },
  "validation": {
    "require_provenance": true,
    "allow_detached_details": false
  },
  "export": {
    "formats": [
      "frames",
      "atlas",
      "gif",
      "webp",
      "browser"
    ],
    "static_state": "establish",
    "static_frame": 0
  },
  "events": {
    "start": "establish",
    "conflict": "react",
    "ending": "resolve"
  }
}
